{
  "$schema": "https://json-schema.org/draft/2020-12/schema",
  "$id": "solar-observation-sequence-v1.schema.json",
  "type": "object",
  "additionalProperties": false,
  "required": [
    "schema_version",
    "id",
    "recipe_version",
    "source_manifest_sha256",
    "mission",
    "instrument",
    "channel_id",
    "wavelength_angstrom",
    "intensity_kind",
    "intensity_units",
    "display_transfer_id",
    "calibration_id",
    "observer",
    "coordinate_system",
    "registration_recipe",
    "valid_time_range",
    "expected_cadence_seconds",
    "frames",
    "credits",
    "source_urls",
    "limitations",
    "original_time_scale"
  ],
  "properties": {
    "schema_version": {
      "type": "string",
      "const": "solar-observation-sequence.v1"
    },
    "id": {
      "type": "string",
      "pattern": "^sdo-aia171-[a-f0-9]{16}$"
    },
    "recipe_version": {
      "type": "string",
      "const": "helioviewer-jp2-reduce3-jpeg88-v1"
    },
    "source_manifest_sha256": {
      "type": "string",
      "pattern": "^[a-f0-9]{64}$"
    },
    "mission": {
      "type": "string",
      "const": "SDO"
    },
    "instrument": {
      "type": "string",
      "const": "AIA"
    },
    "channel_id": {
      "type": "string",
      "const": "aia-171"
    },
    "wavelength_angstrom": {
      "type": "integer",
      "const": 171
    },
    "intensity_kind": {
      "type": "string",
      "const": "provider_display"
    },
    "intensity_units": {
      "type": "string",
      "const": "provider-stretched display values"
    },
    "display_transfer_id": {
      "type": "string",
      "const": "provider-jp2-transfer-unqualified"
    },
    "calibration_id": {
      "const": null
    },
    "observer": {
      "type": "string",
      "const": "SDO"
    },
    "coordinate_system": {
      "type": "string",
      "const": "source-image-plane"
    },
    "registration_recipe": {
      "type": "string",
      "const": "none-source-facing-only"
    },
    "valid_time_range": {
      "type": "array",
      "minItems": 2,
      "maxItems": 2,
      "items": {
        "type": "string",
        "pattern": "^\\d{4}-\\d{2}-\\d{2}T\\d{2}:\\d{2}:\\d{2}(?:\\.\\d{1,6})?Z$"
      }
    },
    "expected_cadence_seconds": {
      "type": "number",
      "minimum": 36,
      "maximum": 3600
    },
    "frames": {
      "type": "array",
      "minItems": 2,
      "maxItems": 121,
      "items": {
        "$ref": "#/$defs/frame"
      }
    },
    "credits": {
      "type": "string",
      "minLength": 1
    },
    "source_urls": {
      "type": "array",
      "minItems": 1,
      "maxItems": 8,
      "items": {
        "type": "string",
        "pattern": "^https://api\\.helioviewer\\.org/"
      }
    },
    "limitations": {
      "type": "array",
      "minItems": 1,
      "maxItems": 12,
      "items": {
        "type": "string",
        "minLength": 1
      }
    },
    "original_time_scale": {
      "type": "string",
      "const": "UTC"
    }
  },
  "$defs": {
    "frame": {
      "type": "object",
      "additionalProperties": false,
      "required": [
        "id",
        "observed_at",
        "exposure_seconds",
        "quality_raw",
        "quality_interpretation",
        "source_sha256",
        "metadata_sha256",
        "asset_path",
        "bytes",
        "sha256",
        "width",
        "height",
        "coverage_mask_path",
        "wcs",
        "gap_before_seconds",
        "permitted_interpolation",
        "source_url",
        "metadata_url"
      ],
      "properties": {
        "id": {
          "type": "string",
          "pattern": "^hv-[0-9]+$"
        },
        "observed_at": {
          "type": "string",
          "pattern": "^\\d{4}-\\d{2}-\\d{2}T\\d{2}:\\d{2}:\\d{2}(?:\\.\\d{1,6})?Z$"
        },
        "exposure_seconds": {
          "type": [
            "number",
            "null"
          ],
          "minimum": 0
        },
        "quality_raw": {
          "type": [
            "integer",
            "null"
          ],
          "minimum": 0
        },
        "quality_interpretation": {
          "type": "string",
          "const": "unqualified-provider-quality"
        },
        "source_sha256": {
          "type": "string",
          "pattern": "^[a-f0-9]{64}$"
        },
        "metadata_sha256": {
          "type": "string",
          "pattern": "^[a-f0-9]{64}$"
        },
        "asset_path": {
          "type": "string",
          "pattern": "^textures/solar/sequence/sdo-aia171-[a-f0-9]{16}/frame-[0-9]{3}\\.jpg$"
        },
        "bytes": {
          "type": "integer",
          "minimum": 1,
          "maximum": 262144
        },
        "sha256": {
          "type": "string",
          "pattern": "^[a-f0-9]{64}$"
        },
        "width": {
          "type": "integer",
          "const": 512
        },
        "height": {
          "type": "integer",
          "const": 512
        },
        "coverage_mask_path": {
          "const": null
        },
        "wcs": {
          "type": "object",
          "additionalProperties": {
            "type": "number"
          }
        },
        "gap_before_seconds": {
          "type": "number",
          "minimum": 0,
          "maximum": 7200
        },
        "permitted_interpolation": {
          "type": "string",
          "const": "none"
        },
        "source_url": {
          "type": "string",
          "pattern": "^https://api\\.helioviewer\\.org/"
        },
        "metadata_url": {
          "type": "string",
          "pattern": "^https://api\\.helioviewer\\.org/"
        }
      }
    }
  }
}
