{
  "calibration_id": null,
  "channel_id": "aia-171",
  "coordinate_system": "source-image-plane",
  "credits": "NASA/SDO AIA; ESA/NASA Helioviewer Project; JP2 generation LMSAL",
  "display_transfer_id": "provider-jp2-transfer-unqualified",
  "expected_cadence_seconds": 60,
  "frames": [
    {
      "asset_path": "textures/solar/sequence/sdo-aia171-b2ba792d2ad18dcd/frame-000.jpg",
      "bytes": 41568,
      "coverage_mask_path": null,
      "exposure_seconds": 2.000157,
      "gap_before_seconds": 0,
      "height": 512,
      "id": "hv-156617024",
      "metadata_sha256": "11478a0cd9c7e0430e6482b40e98eade5ba1df1384140ee6e44ac51675450e9e",
      "metadata_url": "https://api.helioviewer.org/v2/getJP2Header/?id=156617024",
      "observed_at": "2024-05-10T16:29:57.349Z",
      "permitted_interpolation": "none",
      "quality_interpretation": "unqualified-provider-quality",
      "quality_raw": 1073741824,
      "sha256": "c67ab1ac62f4e00e611735b84cec9e7583e7b8f96e099305b6320e4775991fb2",
      "source_sha256": "69b16ee79808206cd6bb611c68e847a5efb5b94f14594d4f8bb81ef13eba2cda",
      "source_url": "https://api.helioviewer.org/v2/getJP2Image/?date=2024-05-10T16%3A29%3A57.349Z&sourceId=10",
      "wcs": {
        "CDELT1": 0.60000002,
        "CDELT2": 0.60000002,
        "CRLN_OBS": 304.50275,
        "CRLT_OBS": -3.1309283,
        "CROTA2": 0.0,
        "CRPIX1": 2048.5,
        "CRPIX2": 2048.5,
        "CRVAL1": 0.0,
        "CRVAL2": 0.0,
        "DSUN_OBS": 151060080000.0,
        "RSUN_OBS": 950.35572
      },
      "width": 512
    },
    {
      "asset_path": "textures/solar/sequence/sdo-aia171-b2ba792d2ad18dcd/frame-001.jpg",
      "bytes": 41595,
      "coverage_mask_path": null,
      "exposure_seconds": 2.000159,
      "gap_before_seconds": 72.0,
      "height": 512,
      "id": "hv-156617022",
      "metadata_sha256": "38af7aba7f9a58a6bdf7ff2b957779a768674ceee8f2418fd23636a4a7a0d8d9",
      "metadata_url": "https://api.helioviewer.org/v2/getJP2Header/?id=156617022",
      "observed_at": "2024-05-10T16:31:09.349Z",
      "permitted_interpolation": "none",
      "quality_interpretation": "unqualified-provider-quality",
      "quality_raw": 1073741824,
      "sha256": "87bdd7b38429d1acd4c67221b3d9709c11ca6d680b57f907920228526f77d04f",
      "source_sha256": "1cc1cc19ef17eb43681d5531ad335c8e38ae2fe9619e091e9174ebc847ed34ab",
      "source_url": "https://api.helioviewer.org/v2/getJP2Image/?date=2024-05-10T16%3A31%3A09.349Z&sourceId=10",
      "wcs": {
        "CDELT1": 0.60000002,
        "CDELT2": 0.60000002,
        "CRLN_OBS": 304.49167,
        "CRLT_OBS": -3.1308711,
        "CROTA2": 0.0,
        "CRPIX1": 2048.5,
        "CRPIX2": 2048.5,
        "CRVAL1": 0.0,
        "CRVAL2": 0.0,
        "DSUN_OBS": 151059990000.0,
        "RSUN_OBS": 950.35631
      },
      "width": 512
    },
    {
      "asset_path": "textures/solar/sequence/sdo-aia171-b2ba792d2ad18dcd/frame-002.jpg",
      "bytes": 41627,
      "coverage_mask_path": null,
      "exposure_seconds": 2.00018,
      "gap_before_seconds": 36.001,
      "height": 512,
      "id": "hv-156617021",
      "metadata_sha256": "ebb7c139356e62d468cc8a88a9eff13047dd8999e4d85b6dcbbe522cc5e8913f",
      "metadata_url": "https://api.helioviewer.org/v2/getJP2Header/?id=156617021",
      "observed_at": "2024-05-10T16:31:45.350Z",
      "permitted_interpolation": "none",
      "quality_interpretation": "unqualified-provider-quality",
      "quality_raw": 1073741824,
      "sha256": "419d3243092588acd3a16510c0230edf6a658ff2e763977fe2dd67241dd9431c",
      "source_sha256": "1d31907b6702e0fb69a0f5ae6b05ce9fe44822dbea0bcfe6b3bcee1ac084541c",
      "source_url": "https://api.helioviewer.org/v2/getJP2Image/?date=2024-05-10T16%3A31%3A45.350Z&sourceId=10",
      "wcs": {
        "CDELT1": 0.60000002,
        "CDELT2": 0.60000002,
        "CRLN_OBS": 304.48611,
        "CRLT_OBS": -3.1308422,
        "CROTA2": 0.0,
        "CRPIX1": 2048.5,
        "CRPIX2": 2048.5,
        "CRVAL1": 0.0,
        "CRVAL2": 0.0,
        "DSUN_OBS": 151059940000.0,
        "RSUN_OBS": 950.35661
      },
      "width": 512
    },
    {
      "asset_path": "textures/solar/sequence/sdo-aia171-b2ba792d2ad18dcd/frame-003.jpg",
      "bytes": 41620,
      "coverage_mask_path": null,
      "exposure_seconds": 2.00018,
      "gap_before_seconds": 72.0,
      "height": 512,
      "id": "hv-156617019",
      "metadata_sha256": "76ce54d4b891f565c5e64df274802894ca4f6782d855ca43344179613edd80ad",
      "metadata_url": "https://api.helioviewer.org/v2/getJP2Header/?id=156617019",
      "observed_at": "2024-05-10T16:32:57.350Z",
      "permitted_interpolation": "none",
      "quality_interpretation": "unqualified-provider-quality",
      "quality_raw": 1073741824,
      "sha256": "ef6b0a4f896b9efb313201861f2aed62679e644d3bc449871f19db29c14d2625",
      "source_sha256": "773ae42cc824879584f71b5184c8d7a56d19d0c3709aad87e3b0d1098c340645",
      "source_url": "https://api.helioviewer.org/v2/getJP2Image/?date=2024-05-10T16%3A32%3A57.350Z&sourceId=10",
      "wcs": {
        "CDELT1": 0.60000002,
        "CDELT2": 0.60000002,
        "CRLN_OBS": 304.47504,
        "CRLT_OBS": -3.1307845,
        "CROTA2": 0.0,
        "CRPIX1": 2048.5,
        "CRPIX2": 2048.5,
        "CRVAL1": 0.0,
        "CRVAL2": 0.0,
        "DSUN_OBS": 151059850000.0,
        "RSUN_OBS": 950.35719
      },
      "width": 512
    },
    {
      "asset_path": "textures/solar/sequence/sdo-aia171-b2ba792d2ad18dcd/frame-004.jpg",
      "bytes": 41539,
      "coverage_mask_path": null,
      "exposure_seconds": 2.000177,
      "gap_before_seconds": 48.0,
      "height": 512,
      "id": "hv-156617433",
      "metadata_sha256": "9dcfb1d03eff2b8f6b61f62e6a52edec5c6528add1c13cc6169ba5fa9288084c",
      "metadata_url": "https://api.helioviewer.org/v2/getJP2Header/?id=156617433",
      "observed_at": "2024-05-10T16:33:45.350Z",
      "permitted_interpolation": "none",
      "quality_interpretation": "unqualified-provider-quality",
      "quality_raw": 1073741824,
      "sha256": "a20d1afc515001ecfc0cc951aed4c7bef92a027e6891da8aee5ce74f5c92121e",
      "source_sha256": "31c25ce005d654950c292e4bad9013de5471aa9edade91a580438f833c4d6fb3",
      "source_url": "https://api.helioviewer.org/v2/getJP2Image/?date=2024-05-10T16%3A33%3A45.350Z&sourceId=10",
      "wcs": {
        "CDELT1": 0.60000002,
        "CDELT2": 0.60000002,
        "CRLN_OBS": 304.46765,
        "CRLT_OBS": -3.1307459,
        "CROTA2": 0.0,
        "CRPIX1": 2048.5,
        "CRPIX2": 2048.5,
        "CRVAL1": 0.0,
        "CRVAL2": 0.0,
        "DSUN_OBS": 151059790000.0,
        "RSUN_OBS": 950.35758
      },
      "width": 512
    },
    {
      "asset_path": "textures/solar/sequence/sdo-aia171-b2ba792d2ad18dcd/frame-005.jpg",
      "bytes": 41500,
      "coverage_mask_path": null,
      "exposure_seconds": 2.000182,
      "gap_before_seconds": 72.0,
      "height": 512,
      "id": "hv-156617431",
      "metadata_sha256": "c5621d68c63187bdb73ba2beae18b20ef1f8dd3d92816d8bd443da1a39fc16de",
      "metadata_url": "https://api.helioviewer.org/v2/getJP2Header/?id=156617431",
      "observed_at": "2024-05-10T16:34:57.350Z",
      "permitted_interpolation": "none",
      "quality_interpretation": "unqualified-provider-quality",
      "quality_raw": 1073741824,
      "sha256": "91e41d78b5cc295038fdc506e06741c19f104ab4ec1c63a4fa0de3c13080d5c4",
      "source_sha256": "2f0924f0a0632731271fab98aa6c4b3a52fd91fec54e13db0e29402ae7830a93",
      "source_url": "https://api.helioviewer.org/v2/getJP2Image/?date=2024-05-10T16%3A34%3A57.350Z&sourceId=10",
      "wcs": {
        "CDELT1": 0.60000002,
        "CDELT2": 0.60000002,
        "CRLN_OBS": 304.45657,
        "CRLT_OBS": -3.1306877,
        "CROTA2": 0.0,
        "CRPIX1": 2048.5,
        "CRPIX2": 2048.5,
        "CRVAL1": 0.0,
        "CRVAL2": 0.0,
        "DSUN_OBS": 151059690000.0,
        "RSUN_OBS": 950.35816
      },
      "width": 512
    },
    {
      "asset_path": "textures/solar/sequence/sdo-aia171-b2ba792d2ad18dcd/frame-006.jpg",
      "bytes": 41530,
      "coverage_mask_path": null,
      "exposure_seconds": 2.000175,
      "gap_before_seconds": 72.0,
      "height": 512,
      "id": "hv-156617429",
      "metadata_sha256": "272f5f4fd0a21e607db042de16a8c18c2177f0e2c6b33cb2cebc0eb166c98ff8",
      "metadata_url": "https://api.helioviewer.org/v2/getJP2Header/?id=156617429",
      "observed_at": "2024-05-10T16:36:09.350Z",
      "permitted_interpolation": "none",
      "quality_interpretation": "unqualified-provider-quality",
      "quality_raw": 1073741824,
      "sha256": "15bb4ebc5795ba6b13ec90ab6cede5440d9f341090dc0dbf99d25ac6b9e9f36a",
      "source_sha256": "9bbba2d6872458ecbc5ead05647ac1aa2922a36b761e00e50eb42a6d2b0a3c61",
      "source_url": "https://api.helioviewer.org/v2/getJP2Image/?date=2024-05-10T16%3A36%3A09.350Z&sourceId=10",
      "wcs": {
        "CDELT1": 0.60000002,
        "CDELT2": 0.60000002,
        "CRLN_OBS": 304.4455,
        "CRLT_OBS": -3.1306295,
        "CROTA2": 0.0,
        "CRPIX1": 2048.5,
        "CRPIX2": 2048.5,
        "CRVAL1": 0.0,
        "CRVAL2": 0.0,
        "DSUN_OBS": 151059600000.0,
        "RSUN_OBS": 950.35874
      },
      "width": 512
    },
    {
      "asset_path": "textures/solar/sequence/sdo-aia171-b2ba792d2ad18dcd/frame-007.jpg",
      "bytes": 41526,
      "coverage_mask_path": null,
      "exposure_seconds": 2.000162,
      "gap_before_seconds": 35.999,
      "height": 512,
      "id": "hv-156617428",
      "metadata_sha256": "855450e7761f8f8f0843b1c53fc46df0f9ac1a5fb2248c4995b9ce89c403cb06",
      "metadata_url": "https://api.helioviewer.org/v2/getJP2Header/?id=156617428",
      "observed_at": "2024-05-10T16:36:45.349Z",
      "permitted_interpolation": "none",
      "quality_interpretation": "unqualified-provider-quality",
      "quality_raw": 1073741824,
      "sha256": "5dbdf07d724a116813b6de946cc735c4ca80ed5b9cd2c4271b9ed672d90bbd0c",